{
  "run": {
    "number": 400,
    "url": "https://github.com/ChilliCream/graphql-federation-benchmarks/actions/runs/38806982970",
    "startedAt": "2026-10-15T21:04:03Z",
    "completedAt": "2026-10-16T10:24:10Z",
    "sourceCommit": "c6dfd7cac7fcfb64cc1ff77b0057cc009ae069f2"
  },
  "hardware": {
    "host": "bench-001",
    "cpu": "AMD Ryzen 7 5700G with Radeon Graphics",
    "logicalCpus": 16,
    "memoryGb": 122,
    "os": "Linux 6.8.0-147-generic"
  },
  "subgraphs": {
    "framework": {
      "name": "Hot Chocolate",
      "version": "16.6.8"
    },
    "platform": {
      "language": {
        "name": "C#"
      },
      "runtime": {
        "name": ".NET",
        "version": "10.0.13"
      }
    }
  },
  "gateways": [
    {
      "id": "apollo-gateway",
      "name": "Apollo Gateway",
      "vendor": "Apollo",
      "repositoryUrl": "https://github.com/apollographql/federation",
      "variants": [
        {
          "id": "apollo-gateway",
          "version": "2.14.4",
          "composition": "apollo-federation",
          "platform": {
            "language": {
              "name": "TypeScript"
            },
            "runtime": {
              "name": "Node.js",
              "version": "22.23.3"
            }
          }
        }
      ]
    },
    {
      "id": "apollo-router",
      "name": "Apollo Router",
      "vendor": "Apollo",
      "repositoryUrl": "https://github.com/apollographql/router",
      "variants": [
        {
          "id": "apollo-router",
          "version": "2.18.0",
          "composition": "apollo-federation",
          "platform": {
            "language": {
              "name": "Rust"
            }
          }
        },
        {
          "id": "apollo-router-v3",
          "version": "3.0.0-preview.0",
          "composition": "apollo-federation",
          "platform": {
            "language": {
              "name": "Rust"
            }
          }
        }
      ]
    },
    {
      "id": "caliban",
      "name": "Caliban",
      "vendor": "ghostdogpr",
      "repositoryUrl": "https://github.com/ghostdogpr/caliban",
      "variants": [
        {
          "id": "caliban",
          "version": "3.2.0",
          "composition": "apollo-federation",
          "platform": {
            "language": {
              "name": "Scala"
            },
            "runtime": {
              "name": "JVM",
              "version": "25.0.4"
            }
          }
        }
      ]
    },
    {
      "id": "cosmo",
      "name": "Cosmo Router",
      "vendor": "WunderGraph",
      "repositoryUrl": "https://github.com/wundergraph/cosmo",
      "variants": [
        {
          "id": "cosmo",
          "version": "0.359.0",
          "composition": "apollo-federation",
          "platform": {
            "language": {
              "name": "Go"
            },
            "runtime": {
              "name": "Go"
            }
          }
        }
      ]
    },
    {
      "id": "grafbase",
      "name": "Grafbase Gateway",
      "vendor": "Grafbase",
      "repositoryUrl": "https://github.com/grafbase/grafbase",
      "variants": [
        {
          "id": "grafbase",
          "version": "0.53.5",
          "composition": "apollo-federation",
          "platform": {
            "language": {
              "name": "Rust"
            }
          }
        }
      ]
    },
    {
      "id": "hive-gateway",
      "name": "Hive Gateway",
      "vendor": "The Guild",
      "repositoryUrl": "https://github.com/graphql-hive/gateway",
      "variants": [
        {
          "id": "hive-gateway",
          "version": "2.15.2",
          "composition": "apollo-federation",
          "platform": {
            "language": {
              "name": "TypeScript"
            },
            "runtime": {
              "name": "Node.js",
              "version": "22.23.3"
            }
          }
        },
        {
          "id": "hive-gateway-router-runtime",
          "version": "2.15.2",
          "composition": "apollo-federation",
          "platform": {
            "language": {
              "name": "TypeScript"
            },
            "runtime": {
              "name": "Node.js",
              "version": "22.23.3"
            }
          },
          "features": [
            {
              "id": "router-runtime",
              "description": "Rust query planner/executor (@graphql-hive/router-runtime) instead of the JS one."
            }
          ]
        }
      ]
    },
    {
      "id": "hive-router",
      "name": "Hive Router",
      "vendor": "The Guild",
      "repositoryUrl": "https://github.com/graphql-hive/router",
      "variants": [
        {
          "id": "hive-router",
          "version": "0.3.5",
          "composition": "apollo-federation",
          "platform": {
            "language": {
              "name": "Rust"
            }
          }
        }
      ]
    },
    {
      "id": "fusion",
      "name": "Fusion",
      "vendor": "ChilliCream",
      "repositoryUrl": "https://github.com/ChilliCream/graphql-platform",
      "variants": [
        {
          "id": "fusion",
          "version": "16.6.8",
          "composition": "composite-schema",
          "platform": {
            "language": {
              "name": "C#"
            },
            "runtime": {
              "name": ".NET",
              "version": "10.0.13"
            }
          }
        },
        {
          "id": "fusion-nightly",
          "version": "16.7.0-p.27",
          "composition": "composite-schema",
          "platform": {
            "language": {
              "name": "C#"
            },
            "runtime": {
              "name": ".NET",
              "version": "10.0.13"
            }
          }
        },
        {
          "id": "fusion-nightly-net11",
          "version": "16.7.0-p.27",
          "composition": "composite-schema",
          "platform": {
            "language": {
              "name": "C#"
            },
            "runtime": {
              "name": ".NET",
              "version": "11.0.0-rc.2.26504.105"
            },
            "features": [
              {
                "id": "runtime-async",
                "description": "C# async methods compiled to runtime-async (.NET 11 opt-in)."
              }
            ]
          }
        },
        {
          "id": "fusion-nightly-fed",
          "version": "16.7.0-p.27",
          "label": "Fusion with Apollo Federation Connector",
          "composition": "apollo-federation",
          "platform": {
            "language": {
              "name": "C#"
            },
            "runtime": {
              "name": ".NET",
              "version": "10.0.13"
            }
          }
        }
      ]
    },
    {
      "id": "feddi",
      "name": "feddi",
      "vendor": "feddi",
      "repositoryUrl": "https://github.com/feddi-dev/feddi-gateway",
      "variants": [
        {
          "id": "feddi",
          "version": "e91d605ed222",
          "composition": "composite-schema",
          "platform": {
            "language": {
              "name": "Java"
            },
            "runtime": {
              "name": "JVM",
              "version": "25.0.4"
            }
          }
        }
      ]
    }
  ],
  "scenarios": [
    {
      "id": "constant",
      "name": "constant-vus-over-time",
      "description": "This scenario executes a constant load of 50 VUs over 120s.",
      "status": "complete",
      "config": {
        "durationSeconds": 120,
        "virtualUsers": 50,
        "subgraphDelayMs": 0,
        "warmupRuns": 1,
        "measuredRuns": 9,
        "cpuAllocation": {
          "gateway": {
            "cpuset": "2-3,10-11",
            "cores": 4
          },
          "subgraphs": {
            "cpuset": "4-7,12-15",
            "cores": 8
          },
          "k6": {
            "cpuset": "1,9",
            "cores": 2
          }
        }
      },
      "results": [
        {
          "gateway": "apollo-gateway",
          "variants": [
            {
              "variant": "apollo-gateway",
              "throughput": {
                "medianRps": 266,
                "bestRps": 271,
                "worstRps": 265,
                "cvPercent": 0.7,
                "runsRps": [
                  271,
                  268,
                  266,
                  266,
                  266,
                  267,
                  265,
                  268,
                  265
                ]
              },
              "latencyMs": {
                "avg": 185.808,
                "min": 7.719,
                "med": 190.666,
                "p90": 200.306,
                "p95": 204.436,
                "p99_9": 274.321,
                "max": 393.163
              },
              "requests": {
                "total": 290303,
                "successful": 290303,
                "failed": 0
              },
              "memory": {
                "peakRssKiB": 2217984
              },
              "cpu": {
                "avgCores": 3.99,
                "maxCores": 4.0
              }
            }
          ]
        },
        {
          "gateway": "apollo-router",
          "variants": [
            {
              "variant": "apollo-router",
              "throughput": {
                "medianRps": 446,
                "bestRps": 462,
                "worstRps": 439,
                "cvPercent": 1.5,
                "runsRps": [
                  462,
                  443,
                  452,
                  442,
                  439,
                  445,
                  446,
                  447,
                  448
                ]
              },
              "latencyMs": {
                "avg": 111.221,
                "min": 5.254,
                "med": 109.165,
                "p90": 146.86,
                "p95": 158.095,
                "p99_9": 203.581,
                "max": 321.308